24/7/2024,world,BBC News
24/7/2024,world,BBC News
24/7/2024,world,Kamala Harris attacks Trump over 'fear and hate' at first rally
24/7/2024,world,Graphic footage shows US officers stood over body of Trump gunman
24/7/2024,world,Drenched in blood - how Bangladesh protests turned deadly
24/7/2024,world,"Gaza release deal has to happen now, hostage's mother says"
24/7/2024,world,Almost one in three people in care were abused in NZ
24/7/2024,world,Pilot only survivor of Nepal plane crash
24/7/2024,world,Australian surfer's leg washes up after shark attack
24/7/2024,world,Janet Jackson on being a child star: 'I don't remember being asked'
24/7/2024,world,Flights resume after climate protest at Cologne airport
24/7/2024,world,"As the Olympics nears, Paris puts 75,000 troops on the streets"
24/7/2024,world,Taiwan grounds flights as it braces for Typhoon Gaemi
24/7/2024,world,Dozens arrested in Uganda anti-government protests
24/7/2024,world,Trash balloons land near S Korea president's office
24/7/2024,world,Watch: Emergency workers pick through wreckage of Nepal plane crash
24/7/2024,world,Watch: Berliners soar over the city on Europe’s highest swing
24/7/2024,world,Breaching whale capsizes boat and sends two people overboard
24/7/2024,world,Watch: Celine Dion in Paris amid rumours of Olympic performance
24/7/2024,world,Wildfires rage in Pacific Northwest US and western Canada
24/7/2024,world,How retired Australian striker earned Olympic comeback
24/7/2024,world,Nicolás Maduro: The leader who promised to win 'by hook or by crook'
24/7/2024,world,Surge in attacks brings fear to calmer parts of Kashmir
24/7/2024,world,Why tech bros are turning to Trump
24/7/2024,world,The tiny Indian village claiming Kamala Harris as its own
24/7/2024,world,Netanyahu faces delicate balancing act in US after Biden exits race
24/7/2024,world,Has Kamala Harris got what it takes to beat Trump?
24/7/2024,uk,BBC News
24/7/2024,uk,BBC News
24/7/2024,uk,Knives seized after attack on army officer in Kent
24/7/2024,uk,Labour suspends seven rebel MPs over two-child benefit cap
24/7/2024,uk,Nine Just Stop Oil activists arrested at Heathrow
24/7/2024,uk,Man arrested over crash that killed six people
24/7/2024,uk,"Arrest after boy, 15, stabbed to death in Hackney"
24/7/2024,uk,Eluned Morgan set to be first woman to lead Wales
24/7/2024,uk,Mortgage rate hopes as one lender offers below 4%
24/7/2024,uk,Royals to get extra £45m as Crown Estate profits soar
24/7/2024,uk,GB's Dujardin given provisional ban and out of Games
24/7/2024,uk,Cleverly urges Tory 'discipline' in leadership bid
24/7/2024,uk,British blues pioneer John Mayall dies aged 90
24/7/2024,uk,"UK must be ready to fight war in three years, says Army head"
24/7/2024,uk,Children returned to family after Leeds disorder
24/7/2024,uk,'We were wrongly fined for Dart Charge during a funeral'
24/7/2024,uk,David Lammy arrives in India for trade talks
24/7/2024,uk,BBC boss apologises over Strictly complaints and warns dancers not to cross line
24/7/2024,uk,Bike couple in crash that killed six people named
24/7/2024,uk,Anjem Choudary guilty of directing banned group
24/7/2024,uk,Mortgage rate hopes as one lender offers below 4%
24/7/2024,uk,"Huw Edwards' BBC pay increased by £40,000 last year"
24/7/2024,uk,Bibby Stockholm migrant barge to be closed
24/7/2024,uk,Fewer HS2 seats could force passengers not to travel
24/7/2024,uk,Police officer stabbed in prison now 'stable'
24/7/2024,uk,Eluned Morgan likely to be Wales' first female FM
24/7/2024,uk,"Ska legend 'Gaps' Hendrickson's funeral held, with eulogy from co-singer Black"
24/7/2024,uk,40 suspects identified after city disorder - police
24/7/2024,uk,MP who was raped says parents need to talk more about consent 
24/7/2024,uk,Rare white squirrel spotted on the street
24/7/2024,uk,Watch: Graeme Souness pays tribute to 'determined cookie' living with rare skin condition
24/7/2024,uk,Starmer calls Sunak 'prime minister' in Commons slip-up
24/7/2024,uk,Mum 'can't forgive' police over murdered daughters photos
24/7/2024,uk,"Watch: Blue screens, queues and airport delays worldwide"
24/7/2024,uk,Watch Bashir's five-wicket haul against West Indies
24/7/2024,uk,Tory MP Jenrick says it 'could get worse' for his party
24/7/2024,uk,Labour's first King's Speech: What happened in 60 seconds
24/7/2024,uk,Is it a bird? Man scales street light to free seagull
24/7/2024,uk,Cash-only spending in surprise jump as people budget
24/7/2024,uk,'I've lost £680 because of Carpetright collapse'
24/7/2024,uk,'I was given Freedom of City but not freedom of room'
24/7/2024,uk,How Anjem Choudary was convicted of directing terrorist organisation
24/7/2024,uk,The stars you won't see on the BBC salaries list
24/7/2024,uk,BBC pay 2023-2024: The full list of star salaries
24/7/2024,uk,Armagh GAA fans go the extra mile for final tickets
24/7/2024,uk,Are branded school PE kits on the way out?
24/7/2024,uk,Is bullet hole proof of Bonnie Prince Charlie assassination attempt?
24/7/2024,uk,'Shame stopped me reporting spiking incident'
24/7/2024,business,BBC News
24/7/2024,business,BBC News
24/7/2024,business,CrowdStrike to improve testing after 'bug' caused outage
24/7/2024,business,'I've lost £680 because of Carpetright collapse'
24/7/2024,business,Mortgage rate hopes as one lender offers below 4%
24/7/2024,business,Why tech bros are turning to Trump
24/7/2024,business,Luxury brands suffer as Chinese shoppers hold back
24/7/2024,business,What makes an athletics track fast?
24/7/2024,business,Cash-only spending in surprise jump as people budget
24/7/2024,business,Cyber-security firm rejects $23bn Google takeover
24/7/2024,business,Delta faces probe as CrowdStrike disruption lingers
24/7/2024,business,Fewer HS2 seats could force passengers not to travel
24/7/2024,business,Musk says Tesla to use humanoid robots next year
24/7/2024,business,"DWP must focus on work not welfare, says minister"
24/7/2024,business,Google U-turn over long-running plan to ditch cookies
24/7/2024,business,Japan drugmaker bosses quit as firm probes deaths
24/7/2024,business,"More than 1,500 jobs to go at Carpetright"
24/7/2024,business,CrowdStrike shares hit again as IT disruption continues
24/7/2024,business,Former chancellor Zahawi mulling bid for the Telegraph
24/7/2024,business,Why Nigerians are praying for the success of a new oil refinery
24/7/2024,business,What will future aerial dogfights look like?
24/7/2024,business,How a single IT update caused global havoc
24/7/2024,business,Can we make work meetings more bearable?
24/7/2024,business,How AI is fuelling uncertainty for game developers
24/7/2024,politics,BBC News
24/7/2024,politics,BBC News
24/7/2024,politics,Labour suspends seven rebel MPs over two-child benefit cap
24/7/2024,politics,Chris Mason: Starmer’s ruthless streak on show again
24/7/2024,politics,Cleverly urges Tory 'discipline' in leadership bid
24/7/2024,politics,How will the new Conservative leader be chosen?
24/7/2024,politics,David Lammy arrives in India for trade talks
24/7/2024,politics,Failed asylum seekers to be sent back to Vietnam
24/7/2024,politics,"DWP must focus on work not welfare, says minister"
24/7/2024,politics,Bibby Stockholm migrant barge to be closed
24/7/2024,politics,Labour MP calls for sex buying to be criminalised
24/7/2024,politics,Conservatives plan to name new leader in November
24/7/2024,politics,Former PM Lord Wilson sold papers to help fund his care
24/7/2024,politics,Fewer HS2 seats could force passengers not to travel
24/7/2024,politics,Eluned Morgan likely to be Wales' first female FM
24/7/2024,politics,"Tories spent £700m on Rwanda scheme, Cooper says"
24/7/2024,politics,"Better skills training will cut migration, vows PM"
24/7/2024,politics,"Labour must deliver or risk populist rise, say cabinet ministers"
24/7/2024,politics,Mel Stride considering Tory leadership bid
24/7/2024,politics,Chancellor resists calls to lift two-child benefit cap
24/7/2024,politics,Car washes and beauty sector to be targeted over immigration
24/7/2024,politics,Shipyard support was ‘too risky for taxpayers’
24/7/2024,politics,MP criticised for behaving 'abominably' in Commons
24/7/2024,politics,Zelensky urges PM to help lift Ukraine weapon limits
24/7/2024,politics,UK to resume funding to UN Gaza aid agency
24/7/2024,politics,"MPs' safety 'keeps me awake at night,' says Speaker"
24/7/2024,politics,Election abuse may have been coordinated - adviser
24/7/2024,politics,Chris Mason: UK readies for new US presidential race
24/7/2024,politics,Inside Labour's first fortnight in power
24/7/2024,politics,Unfathomable errors and 'cinnamon bun' strategy: Political end-of-term report cards
24/7/2024,politics,Which voters should the Tories go after now?
24/7/2024,politics,What is the King's Speech and why is it important?
24/7/2024,politics,Chris Mason: My 40 minutes with Ukraine's Zelensky
24/7/2024,politics,Chris Mason: Gething downfall delivers Starmer first headache
24/7/2024,politics,The Welsh first minister who lasted 118 days
24/7/2024,politics,"Labour’s first week: Eight key plans, and the challenges ahead"
24/7/2024,politics,What next for MPs who lost their jobs? - ‘I'm not sure what to do’
24/7/2024,politics,"Pomp, plans and power – what to expect in Labour’s King’s Speech"
24/7/2024,politics,Starmer's first PMQs question from Sunak as prime minister
24/7/2024,politics,MP who was raped says parents need to talk more about consent 
24/7/2024,politics,Starmer calls Sunak 'prime minister' in Commons slip-up
24/7/2024,politics,Not an easy decision - Starmer on Biden standing down
24/7/2024,politics,There is 'a cost to not settling' public sector pay - Reeves
24/7/2024,politics,"Victoria Atkins behaved 'abominably', deputy speaker says"
24/7/2024,health,BBC News
24/7/2024,health,BBC News
24/7/2024,health,Weight-loss drug approved for heart problems in UK
24/7/2024,health,Babies died after hospital neglect - inquest jury
24/7/2024,health,"IT working but delays possible after outage, says NHS"
24/7/2024,health,Woman died after begging GP for help - inquest
24/7/2024,health,Review says puberty blocker curb has not led to suicide rise
24/7/2024,health,UK 'failed citizens' with flawed pandemic plans
24/7/2024,health,How the UK planned for the wrong pandemic
24/7/2024,health,Fall in proportion of IVF cycles funded by NHS 
24/7/2024,health,What does hot weather do to the body?
24/7/2024,health,UV levels explained - how do I protect myself?
24/7/2024,health,Ten tips for sleeping in hot weather
24/7/2024,health,DIY kits may see million more cervical-cancer tests
24/7/2024,health,Are weight-loss injections the answer to obesity?
24/7/2024,health,What is mpox and how is it spread?
24/7/2024,health,Five surprisingly simple ways to optimise your diet
24/7/2024,health,What is the law on assisted suicide and euthanasia?
24/7/2024,health,Will the new Parliament pass the smoking bill?
24/7/2024,health,How much do junior doctors really get paid?
24/7/2024,health,How the UK planned for the wrong pandemic
24/7/2024,health,What is the UK Covid inquiry and what powers does it have?
24/7/2024,health,Covid inquiry: The UK pandemic in numbers
24/7/2024,health,Ex-medical officer close to tears over Covid deaths
24/7/2024,health,Five takeaways from Johnson at the Covid inquiry
24/7/2024,health,'Moronic': Vicious Covid WhatsApps reveal No 10 battles
24/7/2024,health,More money and staff – so why isn't the NHS more productive?
24/7/2024,health,Diabetic patient used social media to find insulin
24/7/2024,health,'My consultant told me I was a medical mystery'
24/7/2024,health,Mum admits ending life of terminally ill son
24/7/2024,health,"Your Voice, Your Vote: Mental health crisis in young"
24/7/2024,health,Hugh Pym: Is sugar the missing ingredient in election manifestos?
24/7/2024,health,How to pull off an election all-nighter
24/7/2024,health,Are we in a summer Covid wave?
24/7/2024,health,Cyber-attack delays child's cancer operation
24/7/2024,health,Faces made of living skin make robots smile
24/7/2024,health,"Top sunscreens fail protection tests, Which? says"
24/7/2024,health,World first epilepsy device fitted in UK boy's skull
24/7/2024,health,How Hollywood star Sheen helped uncover a dark secret
24/7/2024,health,Senior doctors accept pay deal in England
24/7/2024,health,Melanoma skin cancer cases rising in UK
24/7/2024,health,Infected blood victims could get £2m compensation
24/7/2024,health,What is the infected blood scandal and will there be compensation?
24/7/2024,health,'Blood compensation comes too late for my husband'
24/7/2024,health,Children used as 'guinea pigs' in clinical trials
24/7/2024,health,Infected blood inquiry: Five things we have learned
24/7/2024,health,'An abuse by people supposedly there to care'
24/7/2024,health,How 175 British children were infected with HIV
24/7/2024,health,"I lost mum, dad and sister to HIV in blood scandal"
24/7/2024,health,How Dame Deborah James helped save a mum's life
24/7/2024,health,Can health secretary name NHS trusts performing well?
24/7/2024,health,"'I embrace my alopecia, but I’d love my old hair back’"
24/7/2024,health,Sunak reveals he fasts at beginning of the week
24/7/2024,health,'There are loads of people that vape at school'
24/7/2024,education,BBC News
24/7/2024,education,BBC News
24/7/2024,education,We don't know how many people are having babies - and that's a headache for schools
24/7/2024,education,Are branded school PE kits on the way out?
24/7/2024,education,Unis told to manage own budgets after call for bailouts
24/7/2024,education,"Better skills training will cut migration, vows PM"
24/7/2024,education,Reeves hints at above-inflation public sector pay rise
24/7/2024,education,"Families face £1,045 bill for summer holiday clubs"
24/7/2024,education,Term-time holiday fines here to stay - Phillipson
24/7/2024,education,What are T-levels and what are the grades worth?
24/7/2024,education,"How much does uni cost, and will I earn more if I go?"
24/7/2024,education,When is A-level results day 2024?
24/7/2024,education,When is GCSE results day 2024?
24/7/2024,education,GCSE grades: The 9-1 boundaries explained
24/7/2024,education,What are BTecs and how are they graded?
24/7/2024,education,'Paying £240 holiday school fine was a no-brainer'
24/7/2024,education,Fourteen measures from the King’s Speech analysed by BBC experts
24/7/2024,education,BBC Ideas: The rise of 'digital parenting'
24/7/2024,education,How will the government change the way private school fees are taxed?
24/7/2024,education,"Zambia made education free, now classrooms are crammed"
24/7/2024,education,Five big problems the Starmer government has to fix
24/7/2024,education,Everything you need to know about student loans
24/7/2024,education,"If a university goes bust, which students lose most?"
24/7/2024,education,Would a 1.40pm Friday finish stop teachers quitting?
24/7/2024,education,Who gets 15 hours of free childcare and how do I apply?
24/7/2024,science_and_environment,BBC News
24/7/2024,science_and_environment,BBC News
24/7/2024,science_and_environment,Chimps share humans' 'snappy' conversational style
24/7/2024,science_and_environment,Oxygen discovery defies knowledge of the deep ocean
24/7/2024,science_and_environment,UK coal mine fights for future in court
24/7/2024,science_and_environment,Make electricity cheaper to boost heat pumps - climate advisers
24/7/2024,science_and_environment,Dinosaur skeleton fetches record $44.6m at auction
24/7/2024,science_and_environment,New tech aims to keep polar bears and people apart
24/7/2024,science_and_environment,Secret 'sky island' rainforest saved by new discoveries
24/7/2024,science_and_environment,Cave discovered on Moon could be home for humans
24/7/2024,science_and_environment,Can we change how our brains age? These scientists think it’s possible
24/7/2024,science_and_environment,IVF help for wild rhinos from zoo cousins
24/7/2024,science_and_environment,Footage reveals 'miracle eagle chick' in flight
24/7/2024,science_and_environment,"No, UK weather is not being manipulated"
24/7/2024,science_and_environment,Is climate change making hurricanes worse?
24/7/2024,science_and_environment,How Hollywood star Sheen helped uncover a dark secret
24/7/2024,science_and_environment,Crossbows and eerie silences – following Antarctic whales for climate change clues
24/7/2024,science_and_environment,Nature groups launch legal bid over wildlife loss
24/7/2024,science_and_environment,Call for UK agency to regulate harmful chemicals
24/7/2024,science_and_environment,Satellite to probe mystery of clouds and climate 
24/7/2024,science_and_environment,27 new wild swimming sites for England - but are they clean?
24/7/2024,science_and_environment,Together in wonder: North America awed by total solar eclipse
24/7/2024,science_and_environment,Europe's Ariane-6 rocket blasts off on maiden flight
24/7/2024,science_and_environment,Satellite captures first-of-a-kind cloud image
24/7/2024,science_and_environment,Musk's SpaceX to destroy retired space station
24/7/2024,science_and_environment,Who owns the Moon? A new space race means it could be up for grabs
24/7/2024,technology,BBC News
24/7/2024,technology,BBC News
24/7/2024,technology,CrowdStrike to improve testing after 'bug' caused outage
24/7/2024,technology,Why tech bros are turning to Trump
24/7/2024,technology,Cyber-security firm rejects $23bn Google takeover
24/7/2024,technology,Google U-turn over long-running plan to ditch cookies
24/7/2024,technology,Musk says Tesla to use humanoid robots next year
24/7/2024,technology,CrowdStrike shares hit again as IT disruption continues
24/7/2024,technology,'Significant number' of devices fixed - CrowdStrike
24/7/2024,technology,Scam warning as fake emails and websites target users after outage  
24/7/2024,technology,"IT working but delays possible after outage, says NHS"
24/7/2024,technology,Global services slowly recovering after bug causes IT chaos
24/7/2024,technology,CrowdStrike and Microsoft: What we know about global IT outage
24/7/2024,technology,IT outage exposes fragility of tech infrastructure
24/7/2024,technology,CrowdStrike says IT problems will take time to fix
24/7/2024,technology,"Mass IT outage affects airlines, hospitals, media and banks"
24/7/2024,technology,Can we make work meetings more bearable?
24/7/2024,technology,Musk to move SpaceX and X HQ over gender identity law
24/7/2024,technology,'Pivotal' quantum computing chip unveiled
24/7/2024,technology,Microsoft's hire of start-up staff probed as possible merger
24/7/2024,technology,Russia antivirus firm Kaspersky quits US after ban
24/7/2024,technology,"Olympic esports will level the playing field, says boss"
24/7/2024,technology,EU says X’s blue tick accounts deceive users
24/7/2024,technology,"As Apple headset reaches Europe, will VR ever hit the mainstream?"
24/7/2024,technology,Disney investigating massive leak of internal messages
24/7/2024,technology,Pioneering British AI chip designer bought by Japanese firm
24/7/2024,technology,Musk defeats ex-Twitter staff seeking $500m in severance
24/7/2024,technology,Palestinians say Microsoft unfairly closing their accounts
24/7/2024,technology,Samsung becomes first tech giant to launch a smart ring
24/7/2024,technology,Tech giant Samsung workers to strike indefinitely
24/7/2024,technology,Microsoft hiking Xbox Game Pass prices by up to 25%
24/7/2024,technology,Ticketmaster warns customers to take action after hack
24/7/2024,technology,China Tesla rival BYD signs $1bn Turkey plant deal
24/7/2024,technology,"Samsung expects profits to jump by more than 1,400%"
24/7/2024,technology,Tech Life: Athletes using technology to improve performance
24/7/2024,technology,Moment Ariane-6 rocket blasts into space on first flight
24/7/2024,technology,Tech Life: The tech that refuses to die
24/7/2024,technology,How to decode your social media feeds this election
24/7/2024,technology,Tech Life: If we could talk to the animals
24/7/2024,technology,Investigating crime scenes in virtual reality
24/7/2024,technology,Tech Life: Detecting cancer using AI
24/7/2024,technology,Tech Life: Bionic arms and robotic thumbs
24/7/2024,technology,Tech Life: Helping our animal friends
24/7/2024,technology,'We are creating new crops five-times faster'
24/7/2024,technology,Tech Life: The women dating AI chatbots
24/7/2024,technology,TikTokers on why they have to delay ‘adulting’
24/7/2024,technology,Tech Life: Being watched
24/7/2024,technology,Tech Life: Tackling online abuse of athletes
24/7/2024,technology,How phone theft in London was tackled in the 90s
24/7/2024,technology,Tech Life: Help for cancer patients
24/7/2024,technology,Ros Atkins on... How different countries protect children online
24/7/2024,technology,Protecting under-18s from harmful online content
24/7/2024,technology,Tech Life: The mammoth ivory problem
24/7/2024,technology,BBC Verify looks at fake AI-generated Met Gala images
24/7/2024,technology,What will future aerial dogfights look like?
24/7/2024,technology,How AI is fuelling uncertainty for game developers
24/7/2024,technology,Why both businesses and scammers love India's payment system
24/7/2024,technology,Will K-pop's AI experiment pay off?
24/7/2024,technology,Amazon at 30: What next for 'The Everything Company'?
24/7/2024,technology,Is AI the answer for better government services?
24/7/2024,technology,Could the 'flying piano' help transform air cargo?
24/7/2024,technology,Would having an AI boss be better than your current human one?
24/7/2024,technology,The fastest data in the world
24/7/2024,technology,Are rainy days ahead for cloud computing?
24/7/2024,technology,What is 'AI washing' and why is it a problem?
24/7/2024,technology,Could brain-like computers be a 'competition killer'?
24/7/2024,technology,'Insane' amounts of data spurs new storage tech
24/7/2024,technology,Concern rises over AI in adult entertainment
24/7/2024,technology,Could AI put an end to animal testing?
24/7/2024,technology,Australia wants to become a renewable energy superpower. Can it?
24/7/2024,technology,Can 'energy hog' hot tubs be greener?
24/7/2024,technology,Why France's start-up champion has struggled abroad
24/7/2024,technology,'The chatbot has transformed my life'
24/7/2024,technology,Why technology has not transformed building
24/7/2024,entertainment_and_arts,BBC News
24/7/2024,entertainment_and_arts,BBC News
24/7/2024,entertainment_and_arts,Janet Jackson on being a child star: 'I don't remember being asked'
24/7/2024,entertainment_and_arts,Katy Perry's comeback single falters in charts
24/7/2024,entertainment_and_arts,British blues pioneer John Mayall dies aged 90
24/7/2024,entertainment_and_arts,MrBeast co-host quits after grooming allegations
24/7/2024,entertainment_and_arts,"Celine Dion at Olympics would be great, Macron says"
24/7/2024,entertainment_and_arts,Plans for national writing centre put to government
24/7/2024,entertainment_and_arts,Royals to get extra £45m as Crown Estate profits soar
24/7/2024,entertainment_and_arts,"Huw Edwards' BBC pay increased by £40,000 last year"
24/7/2024,entertainment_and_arts,BBC boss says sorry over Strictly complaints
24/7/2024,entertainment_and_arts,American rapper Snoop Dogg to carry Olympic torch 
24/7/2024,entertainment_and_arts,Ska legend Arthur 'Gaps' Hendrickson's funeral held 
24/7/2024,entertainment_and_arts,The stars you won't see on the BBC salaries list
24/7/2024,entertainment_and_arts,The Four Tops' Abdul 'Duke' Fakir dead at 88
24/7/2024,entertainment_and_arts,First ever 'Blind Barbie' doll released
24/7/2024,entertainment_and_arts,"High Energy singer Evelyn Thomas dies, aged 70"
24/7/2024,entertainment_and_arts,Strictly left Paralympian with injuries he'll 'never get over'
24/7/2024,entertainment_and_arts,The BBC's Olympic TV deal and what it means for you
24/7/2024,entertainment_and_arts,BBC pay 2023-2024: The full list of star salaries
24/7/2024,entertainment_and_arts,Keanu Reeves: I think about death all the time
24/7/2024,entertainment_and_arts,What is Kamala Harris's 'brat' rebrand all about?
24/7/2024,entertainment_and_arts,A timeline of how the Strictly saga has unfolded
24/7/2024,entertainment_and_arts,Jade Thirlwall is 'ready to give pop girlie drama'
24/7/2024,entertainment_and_arts,Air strikes can’t stop the music at this Ukrainian festival
24/7/2024,entertainment_and_arts,The Pankhurst musical injecting pop into girl power
24/7/2024,entertainment_and_arts,Watch: Celine Dion in Paris amid rumours of Olympic performance
24/7/2024,entertainment_and_arts,'We will never tolerate unacceptable behaviour' says BBC boss
24/7/2024,entertainment_and_arts,Ten years since the Glasgow Commonwealth Games
24/7/2024,entertainment_and_arts,Drake's Toronto home 'The Embassy' hit by floods
24/7/2024,entertainment_and_arts,Tributes as 'broadcasting titan' Wark leaves Newsnight
24/7/2024,entertainment_and_arts,Moment Gavin Plumb sentenced for Holly Willoughby murder plot
24/7/2024,entertainment_and_arts,"'Hard to imagine' Biden serving full term, says Michael Douglas"
24/7/2024,entertainment_and_arts,'Like walking into Paddington Bear's world'
24/7/2024,world/africa,BBC News
24/7/2024,world/africa,BBC News
24/7/2024,world/africa,Dozens arrested in Uganda anti-government protests
24/7/2024,world/africa,Mexicans arrested in raid on big South African meth lab
24/7/2024,world/africa,Africa's footballers can do 'great things' at Paris 2024
24/7/2024,world/africa,Ethiopia landslide rescuers pull 229 bodies from mud
24/7/2024,world/africa,Nigeria's president warns youth not to join 'sinister' protests
