24/7/2024,world/africa,"Batons, tear gas, live fire - Kenyans face police brutality "
24/7/2024,world/africa,Bodyguard of S Leone's ex-leader jailed over failed coup
24/7/2024,world/africa,Why Nigerians are praying for the success of a new oil refinery
24/7/2024,world/africa,Mass killer who ‘hunted’ black people says police encouraged him
24/7/2024,world/africa,‘I wanted my clitoris back’ –  FGM survivor opts for reconstructive surgery
24/7/2024,world/africa,The African Tour de France cyclist racking up historic wins
24/7/2024,world/africa,"Red carpets, cars and cowries: Africa's top shots"
24/7/2024,world/africa,Impeached judge itching to take on South African president
24/7/2024,world/africa,'They killed my son' - raw grief after Nigeria school collapse
24/7/2024,world/africa,Inside the beauty pageant in one of the world’s worst places to be a woman
24/7/2024,world/africa,Kenya's ‘serial killer’ mystery - five key questions
24/7/2024,world/africa,Leaving Syria's civil war to be a mercenary in Africa
24/7/2024,world/africa,Secret 'sky island' rainforest saved by new discoveries
24/7/2024,world/africa,"Zambia made education free, now classrooms are crammed"
24/7/2024,world/africa,I cannot forgive Mugabe's soldiers – massacre survivor
24/7/2024,world/africa,Rwanda's 99% man set to extend his three decades in power
24/7/2024,world/africa,Fancy fascinators and prickly pears: Africa's top shots
24/7/2024,world/africa,Should I stay or should I go? The dilemma for young Nigerians
24/7/2024,world/africa,The basketball team forging a 'new story' for South Sudan
24/7/2024,world/africa,Morocco's Slaoui riding to Olympic eventing history  
24/7/2024,world/africa,Caf set to break even after 'toxic' past - secretary general
24/7/2024,world/africa,Who was Africa’s first black Olympic gold medallist?
24/7/2024,world/africa,The brothers out to end Africa's Olympic badminton jinx
24/7/2024,world/africa,The dark life of the South African golfer banned for being too good
24/7/2024,world/africa,Late Frawley drop-goal gives Irish thrilling win over South Africa
24/7/2024,world/africa,The three-way international tussle for Lamine Yamal
24/7/2024,world/africa,How data is helping elite athletes beat the smog
24/7/2024,world/africa,Mixed reaction as South Africa dumps superfans 
24/7/2024,world/africa,The first Nigerian badminton player to qualify for back-to-back Olympics
24/7/2024,world/africa,The school bringing hope to children fleeing Sudan's war
24/7/2024,world/africa,‘People shouldn’t pay to breathe’ - asthma in Nigeria
24/7/2024,world/africa,The Moroccan man sentenced to death for fighting for Ukraine
24/7/2024,world/africa,Protests flare in Nairobi over new tax laws
24/7/2024,world/africa,Fatalities after fire engulfs large ammunition dump in Chad
24/7/2024,world/africa,Ghana's first photojournalist turns 95
